{
  "agentName": "researcher",
  "description": "Research the requested topic",
  "graphTaskId": "graph-task",
  "namespace": [
    "tools:parent",
    "tools:graph-task"
  ],
  "parentNamespace": [
    "tools:parent"
  ],
  "parentToolCallId": "tf:tool:W1sidG9vbHM6cGFyZW50Il0sImNhbGwtdGFzayJd",
  "requestRunId": "run-known",
  "schema": "tinkerfin.subagent-provenance",
  "subagentInvocationId": "subagent-2594398b-b209-5a61-a9f0-8a4d6100bbcd"
}
